{
  "id": "road-base",
  "version": "0.1.0",
  "classification": {
    "uniformat": "G2010"
  },
  "names": [
    "Road base, granular"
  ],
  "aliases": [
    "road base",
    "granular base",
    "road structure"
  ],
  "service_life": {
    "median_years": 50,
    "range_years": [
      20,
      80
    ],
    "range_basis": "source_spread"
  },
  "pm_tasks": [],
  "basis": [
    {
      "type": "public_document",
      "life_type": "accounting",
      "title": "Centre Hastings: FIN-003 Capital Asset Policy",
      "url": "https://centrehastings.com/media/fohda5zt/fin-003-capital-asset-policy.pdf",
      "page": 5,
      "label": "Road base",
      "years": 50,
      "note": "Capital asset policy (amortization period). Approved on text check: the label and value were found on the cited page."
    },
    {
      "type": "public_document",
      "life_type": "accounting",
      "title": "Greater Madawaska: By-Law 21-2025 Tangible Capital Asset Policy (Finance Policy 4-02)",
      "url": "https://greatermadawaska.civicweb.net/document/95484",
      "page": 16,
      "label": "Roads - Base",
      "years": 40,
      "note": "Capital asset policy (amortization period). Approved on text check: the label and value were found on the cited page."
    },
    {
      "type": "public_document",
      "life_type": "accounting",
      "title": "Grey Highlands: By-law No. 2026-052, Tangible Capital Asset Policy A09-F-03",
      "url": "https://greyhighlands.civicweb.net/document/406218/",
      "page": 10,
      "label": "Granular A Base",
      "years": 20,
      "note": "Capital asset policy (amortization period). Approved on text check: the label and value were found on the cited page."
    },
    {
      "type": "public_document",
      "life_type": "accounting",
      "title": "Grey Highlands: By-law No. 2026-052, Tangible Capital Asset Policy A09-F-03",
      "url": "https://greyhighlands.civicweb.net/document/406218/",
      "page": 10,
      "label": "Granular B Base",
      "years": 50,
      "note": "Capital asset policy (amortization period). Approved on text check: the label and value were found on the cited page."
    },
    {
      "type": "public_document",
      "life_type": "accounting",
      "title": "Prince Edward: FIN-12 Tangible Capital Assets Policy",
      "url": "https://www.thecounty.ca/wp-content/uploads/2023/09/FIN-12-Tangible-Capital-Asset-Policy.pdf",
      "page": 34,
      "label": "Roads - Base",
      "years": 50,
      "note": "Capital asset policy (amortization period). Approved on text check: the label and value were found on the cited page."
    },
    {
      "type": "public_document",
      "life_type": "accounting",
      "title": "Quinte West: A09-POLICY-0034 Tangible Capital Asset Policy",
      "url": "https://quintewest.ca/wp-content/uploads/2024/05/A09-POLICY-0034_-_Tangible_Capital_Asset_Policy.pdf",
      "page": 36,
      "label": "Roads - Base",
      "years": 35,
      "note": "Capital asset policy (amortization period). Approved on text check: the label and value were found on the cited page."
    },
    {
      "type": "public_document",
      "life_type": "accounting",
      "title": "Rainy River: F-9 Tangible Capital Assets Policy",
      "url": "https://rainyriver.ca/uploads/plans-policies/finance-department/f9-tangible-capital-assets-policy.pdf",
      "page": 11,
      "label": "Roads - base",
      "years": 80,
      "note": "Capital asset policy (amortization period). Approved on text check: the label and value were found on the cited page."
    },
    {
      "type": "public_document",
      "life_type": "accounting",
      "title": "Trent Lakes: 5.17 Capital Asset Policy",
      "url": "https://www.trentlakes.ca/media/fjaduus0/517_capital-asset-policy.pdf",
      "page": 10,
      "label": "Roads - Base",
      "years": 60,
      "note": "Capital asset policy (amortization period). Approved on text check: the label and value were found on the cited page."
    }
  ],
  "confidence": {
    "grade": "C",
    "sample_size": null
  },
  "open_questions": [
    "These are Ontario accounting lives from municipal capital asset policies, not planning or observed replacement data.",
    "No preventive maintenance tasks are sourced yet."
  ],
  "contributors": [
    "unfinished.one editors"
  ],
  "last_reviewed": "2026-10-21"
}
