{
  "id": "water-valve",
  "version": "0.5.0",
  "classification": {
    "uniformat": "G3010"
  },
  "names": [
    "Watermain valve"
  ],
  "aliases": [
    "gate valve",
    "main valve",
    "isolation valve"
  ],
  "service_life": {
    "median_years": 50,
    "range_years": [
      40,
      75
    ],
    "range_basis": "source_spread"
  },
  "pm_tasks": [
    {
      "task": "Locate and operate distribution valve",
      "frequency": "P6M",
      "reference": "UFM 3-230-02 Operation and Maintenance (O&M): Water Supply Systems",
      "url": "https://www.wbdg.org/FFC/DOD/UFC/ufm_3_230_02_2026.pdf",
      "page": 124,
      "checklist": "Table 7-1 Valves and Accessories Maintenance Checklist"
    },
    {
      "task": "Lubricate valve stem packing; tighten or replace if leaking",
      "frequency": "P6M",
      "reference": "UFM 3-230-02 Operation and Maintenance (O&M): Water Supply Systems",
      "url": "https://www.wbdg.org/FFC/DOD/UFC/ufm_3_230_02_2026.pdf",
      "page": 124,
      "checklist": "Table 7-1 Valves and Accessories Maintenance Checklist"
    },
    {
      "task": "Check stem alignment and for broken stem or worn nut",
      "frequency": "P6M",
      "reference": "UFM 3-230-02 Operation and Maintenance (O&M): Water Supply Systems",
      "url": "https://www.wbdg.org/FFC/DOD/UFC/ufm_3_230_02_2026.pdf",
      "page": 124,
      "checklist": "Table 7-1 Valves and Accessories Maintenance Checklist"
    },
    {
      "task": "Check, inspect and lubricate valve bypass",
      "frequency": "P6M",
      "reference": "UFM 3-230-02 Operation and Maintenance (O&M): Water Supply Systems",
      "url": "https://www.wbdg.org/FFC/DOD/UFC/ufm_3_230_02_2026.pdf",
      "page": 124,
      "checklist": "Table 7-1 Valves and Accessories Maintenance Checklist"
    },
    {
      "task": "Check and lubricate valve gears",
      "frequency": "P6M",
      "reference": "UFM 3-230-02 Operation and Maintenance (O&M): Water Supply Systems",
      "url": "https://www.wbdg.org/FFC/DOD/UFC/ufm_3_230_02_2026.pdf",
      "page": 124,
      "checklist": "Table 7-1 Valves and Accessories Maintenance Checklist"
    },
    {
      "task": "Check and clean valve vault",
      "frequency": "P6M",
      "reference": "UFM 3-230-02 Operation and Maintenance (O&M): Water Supply Systems",
      "url": "https://www.wbdg.org/FFC/DOD/UFC/ufm_3_230_02_2026.pdf",
      "page": 124,
      "checklist": "Table 7-1 Valves and Accessories Maintenance Checklist"
    },
    {
      "task": "Check butterfly valve stem for leaks",
      "frequency": "P6M",
      "reference": "UFM 3-230-02 Operation and Maintenance (O&M): Water Supply Systems",
      "url": "https://www.wbdg.org/FFC/DOD/UFC/ufm_3_230_02_2026.pdf",
      "page": 124,
      "checklist": "Table 7-1 Valves and Accessories Maintenance Checklist"
    },
    {
      "task": "Check butterfly valve operation and tight closure",
      "frequency": "P1Y",
      "reference": "UFM 3-230-02 Operation and Maintenance (O&M): Water Supply Systems",
      "url": "https://www.wbdg.org/FFC/DOD/UFC/ufm_3_230_02_2026.pdf",
      "page": 124,
      "checklist": "Table 7-1 Valves and Accessories Maintenance Checklist"
    },
    {
      "task": "Clean valve box, check corrosion and alignment",
      "frequency": "P6M",
      "reference": "UFM 3-230-02 Operation and Maintenance (O&M): Water Supply Systems",
      "url": "https://www.wbdg.org/FFC/DOD/UFC/ufm_3_230_02_2026.pdf",
      "page": 127,
      "checklist": "Table 7-1 Valves and Accessories Maintenance Checklist"
    }
  ],
  "basis": [
    {
      "type": "public_document",
      "life_type": "planning",
      "title": "Greater Sudbury: Enterprise Asset Management Plan (2023)",
      "url": "https://www.greatersudbury.ca/city-hall/budget-and-finance/financial-reports-and-plans/pdf-documents/enterprise-asset-management-plan/",
      "page": 26,
      "label": "System Valve",
      "years": 40,
      "note": "Asset management plan (planning life). Approved on text check: the label and value were found on the cited page."
    },
    {
      "type": "public_document",
      "life_type": "accounting",
      "title": "Kenora: AF-6-1 Tangible Capital Asset Policy (By-law 34-2026)",
      "url": "https://listview.kenora.ca/Files/City%20Policy%20Manual/Administration%20and%20Finance/AF-6-1%20Tangible%20Capital%20Asset.pdf",
      "page": 17,
      "label": "Water Mains - Valves",
      "years": 75,
      "note": "Capital asset policy (amortization period). Approved on text check: the label and value were found on the cited page."
    },
    {
      "type": "public_document",
      "life_type": "accounting",
      "title": "Kingston: Tangible Capital Assets Policy",
      "url": "https://cityofkingston.ca/media/pljd1bhs/finance_policy_tangible-capital-asset-policy.pdf",
      "page": 15,
      "label": "Water Utility - Water Other: Water valves",
      "years": 50,
      "note": "Capital asset policy (amortization period). Approved on text check: the label and value were found on the cited page."
    },
    {
      "type": "public_document",
      "life_type": "planning",
      "title": "London: 2023 Corporate Asset Management Plan",
      "url": "https://london.ca/sites/default/files/2023-10/Corporate%20Asset%20Management%20Plan%202023.pdf",
      "page": 70,
      "label": "Valves",
      "years": 50,
      "note": "Asset management plan (planning life). Approved on text check: the label and value were found on the cited page."
    },
    {
      "type": "public_document",
      "life_type": "accounting",
      "title": "Prince Edward: FIN-12 Tangible Capital Assets Policy",
      "url": "https://www.thecounty.ca/wp-content/uploads/2023/09/FIN-12-Tangible-Capital-Asset-Policy.pdf",
      "page": 34,
      "label": "Water - Valves (Pooled)",
      "years": 40,
      "note": "Capital asset policy (amortization period). Approved on text check: the label and value were found on the cited page."
    },
    {
      "type": "public_document",
      "life_type": "accounting",
      "title": "Trent Lakes: 5.17 Capital Asset Policy",
      "url": "https://www.trentlakes.ca/media/fjaduus0/517_capital-asset-policy.pdf",
      "page": 10,
      "label": "Water - Valves",
      "years": 50,
      "note": "Capital asset policy (amortization period). Approved on text check: the label and value were found on the cited page."
    }
  ],
  "confidence": {
    "grade": "C",
    "sample_size": null
  },
  "open_questions": [
    "These are Ontario accounting lives from municipal capital asset policies, not planning or observed replacement data."
  ],
  "contributors": [
    "unfinished.one editors"
  ],
  "last_reviewed": "2026-10-22"
}
